{
  "schemaVersion": "2.0.0",
  "projectName": "fcmoim",
  "updateVersion": 122,
  "updatedAt": "2026-07-02T23:30:22+09:00",
  "updatedBy": "codex",
  "currentPhase": "agent-collaboration-infra",
  "activeWork": {
    "taskId": "agent-handoff-inbox",
    "status": "ready",
    "designMode": "maintenance",
    "baselineCommit": "fb8058b",
    "changedFiles": [
      ".agents/rules/agy-frontend-design.md",
      "AGENT.md",
      "AGENTS.md",
      "docs/agent-boundaries.md",
      "docs/decisions.md",
      "docs/project-context.json",
      "package.json",
      "scripts/agent-handoff-inbox.mjs",
      "tests/agent-handoff-inbox.test.ts"
    ],
    "changedSurfaces": [
      "tests",
      "infra",
      "docs"
    ],
    "allowedPaths": [
      ".agents/rules/agy-frontend-design.md",
      "AGENT.md",
      "AGENTS.md",
      "docs/agent-boundaries.md",
      "docs/decisions.md",
      "docs/project-context.json",
      "package.json",
      "scripts/agent-handoff-inbox.mjs",
      "tests/agent-handoff-inbox.test.ts"
    ],
    "evidence": {
      "roleGuard": {
        "status": "passed",
        "provider": "Codex role guard",
        "command": "npm run guard:role:codex",
        "summary": "Infra, 공용 운영 문서와 Backend 성격의 Git contract 테스트 경로만 변경."
      },
      "baseline": {
        "status": "passed",
        "provider": "Harness, ESLint, TypeScript, Vitest",
        "command": "npm run verify:baseline",
        "summary": "Harness validation, lint 0 errors, typecheck, 30 files 중 27 passed·3 skipped, 250 tests 통과."
      },
      "inboxContract": {
        "status": "passed",
        "provider": "Vitest, shared Git refs",
        "command": "npx vitest run tests/agent-handoff-inbox.test.ts; npm run agents:handoff:inbox -- --role=agy",
        "summary": "타 branch 요청 발견, recipient 필터, 상태 우선 중복 제거, dirty worktree 무변경을 검증했고 실제 comment realtime handoff를 fb8058b에서 발견."
      },
      "browserRuntime": {
        "status": "passed",
        "provider": "npm run dev, HTTP smoke, prior in-app browser evidence",
        "command": "npm run dev; curl http://localhost:3000/",
        "summary": "현재 dev server ready, GET / 200과 server log 오류 0건. 이번 package 변경은 독립 CLI alias 추가뿐이고 app/runtime 코드는 직전 first screen 렌더 및 browser console error/warn 0건 통과 시점과 동일."
      },
      "harnessFull": {
        "status": "passed",
        "provider": "Agent Harness",
        "command": "npm run harness:guard:full",
        "summary": "validate, token sync, design, diff, baseline, DB contract와 evidence guard 전체 통과."
      }
    },
    "retrospective": {
      "issuesObserved": [
        "Agy 재사용 rule에 프로젝트 npm 명령을 직접 넣어 Harness purity가 한 차례 차단했고, rule에는 원칙만 남기고 실제 명령은 프로젝트 문서로 이동.",
        "현재 in-app browser가 기존 세션 tab에 연결되지 않아 app/runtime 코드 무변경을 확인하고 현재 dev server·HTTP·server log와 직전 browser evidence를 결합."
      ],
      "missedEvidence": [
        "현재 세션의 새 in-app browser console 재수집은 browser session 연결 불일치로 생략."
      ],
      "harnessImprovementProposal": [],
      "promotionRecommendation": "none",
      "reason": "Harness purity가 의도대로 프로젝트 명령 침투를 차단했으며 추가 정책 변경은 필요하지 않음."
    },
    "reviewStatus": "ready",
    "loopCounters": {
      "reviewRounds": 1,
      "guardRetries": 2
    }
  },
  "workstreams": [
    {
      "id": "agent-handoff-inbox",
      "status": "complete",
      "completedAt": "2026-07-02T23:30:22+09:00",
      "commit": "c5c83d2"
    },
    {
      "id": "comment-realtime-publisher",
      "status": "complete",
      "completedAt": "2026-07-02T23:07:00+09:00",
      "commit": "1d34cb8"
    },
    {
      "id": "codex-agy-role-boundaries",
      "status": "complete",
      "completedAt": "2026-06-29T10:00:00+09:00",
      "commit": "ce9e6fa"
    },
    {
      "id": "multi-club-ready-backend-baseline",
      "status": "blocked",
      "completedAt": null,
      "commit": "fd60f75",
      "blocker": "Supabase linked project ref is not configured; remote history and linked diff remain unverified."
    },
    {
      "id": "single-team-api-contract",
      "status": "complete",
      "completedAt": "2026-06-28T16:36:55+09:00",
      "commit": "dd787d4c460d822b143b616ac23bc48874137991"
    },
    {
      "id": "backend-single-team-domain-repository-cleanup",
      "status": "complete",
      "completedAt": "2026-06-29T02:39:00+09:00",
      "commit": "fe41738"
    },
    {
      "id": "desktop-tactics-studio-dnd-polish",
      "status": "complete",
      "completedAt": "2026-06-25T09:09:13+09:00",
      "commit": "8d6460d9b9a2ad78e9bcec991d3e06dfbb5961a9"
    },
    {
      "id": "light-mode-font-ovr-subtab-icons",
      "status": "complete",
      "completedAt": "2026-06-24T01:15:17+09:00",
      "commit": "0094b409c3e2106b0bbf121aa4d71e01fec54c33"
    },
    {
      "id": "mypage-stat-point-profile-stats",
      "status": "complete",
      "completedAt": "2026-06-13T23:35:36+09:00",
      "commit": "28142024d93cc96c0f5c4dd65ab51ae8fa3c21de"
    },
    {
      "id": "ux-area-04-tactics-mobile-drag-ux",
      "status": "complete",
      "completedAt": "2026-06-13T15:26:18+09:00",
      "commit": "135c10d490a1124bdc7303145e68369a1ef3518a"
    },
    {
      "id": "schedule-detail-tactics-ui-rework",
      "status": "complete",
      "completedAt": "2026-05-20T14:29:33.138Z",
      "commit": "8955a27f722338965b12ef4a03c20269aecce137"
    },
    {
      "id": "announcements-records-schedule-polish",
      "status": "complete",
      "completedAt": "2026-05-17T12:20:13.057Z",
      "commit": "a1ede07bc849a82749853401aeacc70dc0054fc3"
    }
  ],
  "blockers": [],
  "nextActions": [
    "bootstrap으로 agent/codex/handoff-inbox를 main에 통합한 뒤 각 역할 세션에서 inbox 명령을 기본 사용합니다.",
    "Agy가 npm run agents:handoff:inbox -- --role=agy로 comment realtime handoff를 발견하고 Frontend private Broadcast transport를 적용합니다.",
    "Backend/Infra 작업은 fcmoim-codex, Frontend/Design 작업은 fcmoim-agy worktree에서 시작합니다.",
    "교차 요구사항은 docs/handoff/TEMPLATE.md로 전달하고 Codex 통합 단계에서 project context를 갱신합니다.",
    "운영 Supabase project identity와 link를 별도 확인합니다.",
    "로컬과 동일한 baseline version 20260629000427을 운영 schema에 적용한 뒤 history repair와 linked diff를 수행합니다."
  ]
}
